{
  "$schema": "https://json-schema.org/draft/2020-12/schema",
  "$id": "https://github.com/ardas/convo-email-agent/schemas/email-from-reference/creation-brief.schema.json",
  "title": "Native email creation brief",
  "description": "Shared creation wrapper and native editor draft. The build replaces message with the installed provider's schema from reference/creation-policy.json; the builder validates that policy and the completed native model.",
  "type": "object",
  "required": [
    "v",
    "message",
    "model"
  ],
  "additionalProperties": false,
  "properties": {
    "v": {
      "const": 2
    },
    "note": {
      "type": "string"
    },
    "sourceSummary": {
      "type": "array",
      "items": {
        "type": "string"
      }
    },
    "message": {
      "type": "object",
      "required": [
        "name"
      ],
      "additionalProperties": false,
      "description": "Stripo create_email metadata. Title/preheader belong in model.metadata.",
      "properties": {
        "referenceMode": {
          "type": "string",
          "enum": [
            "exact",
            "tailored",
            "creative",
            "copy-action"
          ],
          "default": "creative",
          "description": "Local generation policy; do not send to MCP. copy-action is a legacy alias for tailored."
        },
        "name": {
          "type": "string",
          "minLength": 1,
          "maxLength": 200,
          "pattern": "\\S"
        },
        "projectId": {
          "type": "integer",
          "minimum": 1
        },
        "folderId": {
          "type": "integer",
          "minimum": 1
        }
      }
    },
    "model": {
      "type": "object",
      "description": "Native editor model draft, including metadata.title and metadata.preheader {text, fillSpace} when requested, resources.fonts and fontFamily settings. IDs and default settings may be omitted; native metadata, settings, resources, and block types from a reference are preserved. The bundled editor contract validates the completed model. The builder also limits new or changed metadata text to 500 UTF-16 code units; unchanged longer text requires the acquired rebuild target supplied through --baseline.",
      "required": [
        "stripes"
      ],
      "properties": {
        "stripes": {
          "type": "array",
          "minItems": 1
        }
      }
    }
  }
}
